Texto,Emoción
"They didn't die, they killed themselves for each other. I mean that exactly. A little more selfish and they'd have been here today.",sad
"I got this idea watching them go down. Everything was being destroyed, see, but it seemed that there was one new thing being made. A sort of responsibility. Man for man.",sad
"You know what I mean? To show that, to bring that onto the Earth again, like some kind of monument and everyone would feel it standing behind him and it would make a difference to him.",sad
Then I came back and it was incredible. There was no meaning in it here. The whole thing to them seemed like sort of a bus accident. I went to work with Dad and that rat race again.,sad
"And I felt what you said, ashamed somehow 'cause nobody was changed at all. It seemed to make suckers out of a lot of guys. I felt wrong to be alive to open the new bank book, drive the new car, see the new refrigerator.",sad
"I mean, you can take those things out of a war, but when you drive that car, you've gotta know that it came out of the love a man can have for a man. You've gotta be a little better because of it.",sad
Because otherwise all you have is really loot and there's blood on it. And I didn't want to take any of it. And I guess that included you.,sad
You still feel that way?,sad
What'll I do with a fortune?,happy
What flashlight?,neutral
"Oh, well sure.",neutral
"Right, of course. Our flashlight. Mine and yours. I mean, me flashlight is su flashlight naturally.",neutral
"I wonder, do they always run during a full moon? I can't remember if it was full last year. Do you remember?",neutral
Yeah.,neutral
"You cold? Do you want my jacket? Oh, we should've brought the blanket. Our blanket.",neutral
Do you want my jacket?,neutral
Right.,neutral
That's my point too.,neutral
No. No. That's not my point. The point is there's no point in coming down if we just leave. Don't you want to see it?,neutral
"I don't get it. The first time we came here, you said it was the best night of your life.",neutral
We weren't in a good spot.,neutral
We didn't see them the first time either.,neutral
"Well, so what do you think?",neutral
About what?,neutral
What I was saying.,neutral
About what?,neutral
What I was saying.,neutral
It certainly is not. It's slightly exaggerated scientific fact.,neutral
"Well, I'm not the only one. Look at all these people.",neutral
"Carla, can I ask you something? Don't take this wrong, but are you having your period?",neutral
"God damn it, Augie, don't ask me that. I hate it when you ask me that. You always ask me that. It's insulting.",angry
We just have different ideas of what this evening is supposed to look like.,angry
"There's nothing to it. We come here, the grunion arrive, they do their little fish business, we go ooh, ah, look at the fish. They go home. We go home.",neutral
We've missed them twice. That's not ever.,neutral
"Well, we'll see them this year.",neutral
"I mean, I feel like my whole life is gonna be spent standing on the beach with my eyes wide open and my hands clasped expectantly waiting for the fish to show up. And the fish won't show up.",angry
It's just fish. Nothing to get traumatized about.,neutral
"You said, ""Hey the grunion are running tonight."" I said, ""Great, let's go. I feel lucky.""",neutral
"Okay, so I'm putting on my jacket, putting out the animals, getting the car out of the garage--",neutral
"Do you remember the first time we came to see it? It was about four years ago, right after we got married.",sad
"I thought I was pregnant, you had a bottle of champagne, but no glasses. You asked me to dance, so we kicked off our shoes and you popped the cork.",sad
"And while we were dancing, you said the softest, most intimate things to me right into my ear so that I could feel them as much as hear them.",sad
"And I remember thinking, this is it. You know, at last--at last I am as happy as I am supposed to be.",sad
Wait a minute. I've got it.,neutral
"Just dancing barefoot in the sand, drinking champagne out of the bottle.",sad
"It was in the car, right? Driving past the Knickerbocker Liquor Locker, you said, ""let's get some champagne,"" and I said, ""time's a wasting"" or something like that, right?",neutral
"Yeah, of course, I see it now. You want this to be like that other time, right? That's it, right?",neutral
I'd rather not remember some things. I would rather not hope for some things.,sad
"Okay, yeah, sure, I see it now. Listen, you wanna dance?",neutral
No.,sad
You want me to go get some champagne?,neutral
No.,sad
Take off our shoes?,neutral
No.,sad
"Well, welcome to the human race. Do you think this is what I had in mind when I proposed? That four years down the road, we'd be at the beach yelling at each other over fish?",angry
"No, Carla, I'm just like you. I thought it was gonna be all peaches and roses and sand in our toes and wind in our hair and the fish will always come and the bills will pay themselves and we'll have three fat rosy kids and ha, ha, baby, the joke's on us",sad
"Yes, it is.",neutral
Right.,neutral
Well. This isn't anything like I thought anything would be like.,sad
"I know, me neither.",sad
I'm doing the best I can.,sad
"I know that, Augie. Really, I do.",sad
"I know that you meant this to be special and nice and the sand and the moon and all, but I just couldn't help thinking about being somewhere else.",sad
Maybe if you were with somebody else too.,sad
I didn't say that.,sad
"No, I know. But still. I know I don't make you happy.",sad
Yeah?,surprise
You're the one who probably wishes you were with someone else. Someone who--you'd rather enjoy yourself and didn't take everything so hard.,sad
"I don't know. It seemed like a pretty good spot to me. I mean, look at the view you have of the moon from here.",happy
"Well, look what we have here.",happy
"Augie, you brought refreshments.",happy
It's not champagne.,happy
"Well, then we don't need glasses.",happy
No. I think you might be right. Maybe this is the spot after all.,happy
"Augie, I'm sorry.",sad
Shh. If we're very quiet the fish might come.,happy
Or not.,happy
Or not.,happy
Do you think it's them?,fear
I wonder.,neutral
"Well, nobody know we're here except Freda and she wouldn't ring up.",fear
What're we gonna do?,fear
I don't care then.,neutral
Hello? Hello? What? Wrong number.,neutral
Behave exquisitely.,happy
With the most perfect poise?,neutral
"Oh, of course. I shall probably do a court curtsy.",happy
Things that ought to matter dreadfully don't matter at all when one's happy. Do they?,neutral
What's so horrible is that one can't stay happy.,happy
"Oh, darling, don't say that.",neutral
It's true. The whole business is a very poor joke.,happy
"Meaning that sacred and beautiful thing, love?",neutral
"Yes, meaning just that.",happy
"You mustn't be serious, my dear one. That's just what they want.",neutral
Who's they?,neutral
All those futile moralists that try to make life unbearable. Laugh at them. Be flippant. Laugh at everything. All their sacred shibboleths.,neutral
Flippancy brings out the acid in their damn sweetness and light.,neutral
"If I laugh at everything, then I must laugh at us too.",neutral
"Certainly, you must. We're figures of fun, alright.",neutral
"Well how long will it last us, this ludicrous overbearing love of ours.",neutral
Who knows.,neutral
"Well, shall we always want to bicker and fight?",neutral
"No, that desire will fade. Along with our passion.",neutral
"Oh, dear, shall we like that?",neutral
Depends on how well we've played.,neutral
"Well, what happens if one of us dies? I mean, does the one that's left still laugh?",neutral
"Darling, I believe you're talking nonsense.",happy
So is everyone else in the long run.,neutral
"Elliott, worms don't pop.",happy
"I don't care what you do. See, you could paint yourself green and dance naked in the Place Vendome and rush off madly with all the men in the world and I shan't say a word. As long as you love me best.",neutral
"Oh, thank you, dear. The same applies to you except that if I catch so much as looking at another woman, I'll kill you.",happy
You remember that awful scene we had in Venice?,neutral
Which particular one?,happy
The one when you bought that little painted wooden snake in the Piazza and put it on my bed.,neutral
Charles. That was his name. Charles. He did wriggle so beautifully.,happy
"Yes, I know you did. You threw it out of the window into the Grand Canal. I don't think I'll ever forgive you for that.",happy
How long did that row last?,neutral
It went in intermittently for days.,happy
The worst one was in Cannes when your curling iron burnt a hole in my new dressing gown.,neutral
It burned my comb too and all the towels in the bathroom.,happy
That was the first time you ever hit me.,neutral
I didn't hit you very hard.,neutral
"The manager came in and found us rolling around on the floor, biting and scratching like panthers.",happy
We were very much younger then.,neutral
"As a matter of fact, the real cause of that row was Peter Burden.",neutral
"As a matter of fact, the real cause of that row was Peter Burden.",neutral
I knew nothing of the sort. You took presents from him.,neutral
What of it?,angry
"Well, what about me?",angry
"Well, if you hadn't been so suspicious and nosey, you never would have known a thing about it.",neutral
"Me, too. Bored stiff. You want some brandy?",neutral
No particular reason. Anyhow they were very small ones.,neutral
Just seems so silly to go on and on and on with such a thing.,neutral
"Well, it's become a habit with you.",neutral
"You needn't be so grand, just because you don't happen to want any yourself at the moment.",angry
Don't be so stupid.,angry
What?,angry
"Oh, be quiet.",angry
"Adders don't snap, they sting.",angry
You're quite insufferable,angry
I'm not in the least drunk.,angry
Shut up.,angry
"We could get a good debate going about this, don't you think? Intemperate tots.",angry
Why?,angry
"Turn it on again, please.",angry
I'll do no such thing.,angry
"Very well, if you insist on being boorish and idiotic.",angry
Turn it off. It's driving me mad.,angry
You are far too temperamental. Try to control yourself.,angry
Turn it off.,angry
Stop it. Go away. I hate you.,angry
"Amanda, listen. listen",angry
"Listen? Listen, indeed. I am sick and tired of listening to you, damn sadistic bully.",angry
"I hate you. Stop it. Stop it. I hate you, do you hear? You're conceited and overbearing and utterly impossible.",angry
"You're a vile, tempered, loose living, wicked little beast and I hope to never see you again as long as I live.",angry
This is the end. Finally and forever. Do you hear me? The end.,angry
You're not going like this.,angry
"Oh Yes, I am.",angry
You're not.,angry
I am. Let go of me. You're a cruel fiend and I hate and loathe you.,angry
Shut up. Shut up.,angry
I wouldn't-- I wouldn't marry--,angry
I wouldn't marry you if you came in crawling on your knees,angry
Thank God I realized what you are-- I'd never marry you again ever in my life. You're a cruel fiend and I hate you. You're a beast. You're a beast--I hate you. Stop it. Stop it.,angry
You're a evil vampire and I hope to God I never see you again as long as I live.,angry
"Hi, How can I help you?",neutral
"Yea. I just want to get this done,",neutral
"Sure, um",neutral
get my new license.,neutral
do you have two forms of ID with you?,neutral
"Um, no, I got my driver's license though.",neutral
"I actually need two forms of ID. I need either a passport or a birth certificate, or social security card. I'm sorry.",neutral
"Uh, sorry, I forgot them. I mean I've got to -",neutral
Well,neutral
well is the dri-driver's license going to work?,neutral
I- I can take your driver's license but I need another form of ID in order to process this paper work.,neutral
"Um, that you would need to go home and get another form of ID and come back.",neutral
"What? I- You telling me I waited in that huge line to go and sit down and get my number called, like after",angry
three hours and,angry
Shouldn't they have like told us about that? I mean why - why would they make me go and wait three hours if I have got to go and do it again?,angry
"It's standard? I mean I don't work at the D.M.V. how am I supposed to know that, like, I stand in line, I get my",angry
"I filled out the application right, didn't I?",angry
"I'm sorry, sir.",neutral
there is nothing I can do.,neutral
You- shouldn't you have like a sign or something maybe like up on the counter when you get the applica- maybe on the application,angry
"What web- I didn't go to a website - why would I need to - it's the D.M.V.. You come to the D.M.V., you wait in line for three hours, and then you go home.",angry
I don't want you to go.,sad
"I know, I know. I don't want to go either baby. I love you know. And I'm going to miss you a lot.",sad
"I'm going to miss you too; I don't know what I'm going to do here without you. It's going to be so lonely, and so hard.",sad
I don't want to be a single mom.,sad
"You won't be. I'll be back; I'll be back before you know it. All right, and",sad
but,sad
and,sad
It's dangerous; I mean how can you make sure that you'll,sad
I hope so.,sad
I hope so.,sad
It's going to be really rough.,sad
"You gotta take care of our baby for me, alright?",sad
I'll send you lots of pictures.,sad
"I hope so, because I'm not going to be able to survive without all that. I don't know what I'm going to do.",sad
I've never been - I've never been away from you for two weeks let alone a year.,sad
"Well, just promise me that you going to be safe.",sad
"I mean can't they put you in like, you know kitchen work or something where you won't get",sad
there's people that thought it was the right thing to do so now we have to- we have to do what we have to do for our country,sad
"and it'll work out you know, go there and do that. Yeah, I'll be back",neutral
"Will you write me letters, paper ones?",sad
"Our baby needs a dad; you can't leave. Okay, you can't disappear.",sad
"Our baby has a dad, alright. Daddy is going to be back soon.",sad
"I want you to, you know, take lots of video; pictures and I can see you when I get back or while I'm there. I'm going to miss you.",sad
I'll miss you too.,sad
"Oh, well, it was -- you know, we were at this- at this concert and yeah",happy
so I-I talked to some of the crew before hand and-,happy
I-I did.,happy
"I know, so",happy
I got to freak her out.,happy
"Yea, that way she was guaranteed that she could not say no.",happy
"Oh yes, they - they you know they love her and so I mean...",happy
"Oh, it will, obviously you know. But I know it's something - I don't know, you never really think about it happening, like before hand.",happy
"Sure. Oh, yes.",happy
Hah.,happy
So how you feeling?,neutral
"You've been doing a lot of work for it, right?",neutral
"Right, so the fact you doing the best that you can is -",neutral
"you know you shouldn't give yourself a hard time for that, it's the best you can.",neutral
"Well, but you care about what you do, right?",neutral
"I understand that it's so frustrating but I know that you're here because you really want it you know and, and uh",neutral
"Well, I mean you're still here you've tried for this long so I think that says something all in itself.",neutral
You are persistence. I mean that's important. that's,neutral
"Well, you're talented so keep that in mind, you know, you shouldn't give yourself too hard of a time.",neutral
I'm sorry.,sad
"I don't know, it's just not, I don't know - I don't know what to do really, you know, I'm just thinking",sad
"That's- I mean. There are more factors then just whether you're good or not, you know what I mean like",neutral
"and the fact that you know there is always different types of things and what kind of people they want in the office and whether it's male or female or you know what I mean, like things are out of your control.",neutral
So you should take that in consideration rather than giving yourself such a hard time.,neutral
this doesn't happen to a normal person.,angry
"You know and the fact you still here and still cooking, like it's good that you're thinking about it, that you're reconsidering.",neutral
"But like, just because you're considering why it's been so difficult doesn't mean you should just stop.",neutral
"Maybe you should take a little break from it, but I don't think you should stop.",neutral
Right. Thanks for talking to me.,sad
Hi. Um-,neutral
"Hi, can I help you?",neutral
It seems that uh- my-my bag didn't make it out on the carousel.,neutral
"Oh, did you check? Did you make sure as it went around the second time that it-",neutral
"Yes, yes, it's gone around like you know twenty times. It's been about a half hour.",neutral
"Okay. Well, um- the f.",neutral
"Actually I'm looking here at the information, the flight that you were on we had some trouble with some of the baggage, it looks like a few peoples' bags didn't make it through. Um, so-",neutral
Okay. So what-what do I have to get you know,neutral
"Well, you can fill out this paperwork um- and if for some reason it shows up, we can bring it to you, but-",neutral
"For some reason, so you think it won't show up?",surprise
"Well, sometimes it's just late baggage or misplaced baggage and it comes out but it seems to be here and just I'm reading off of this that",neutral
Uh- it didn't make it into the second plane so it looks like there - they don't actually know what happened to it.,neutral
"Um, well, sometimes there is just difficulties with loading on to the plane. Uh- There can be a theft or uh- some sort of you know mishap with a cart or something.",neutral
"I- I- I understand, but um.",neutral
Okay,neutral
Right.,neutral
"I understand that. Um- So I'm going to put down here that you looking for your baggage, but we actually can't, uh this bag is likely not going to show up so what we're going to do-",neutral
"Sometimes it gets stolen, sometimes it gets misplaced on another plane and",neutral
"they - they, it gets shipped to somewhere else and then it's stuck somewhere and then we have no way of tracking that.",neutral
So we'll- what we'll do,neutral
"But we have the tags on. I mean like it wouldn't you know, if it got stuck somewhere it's like well this is nobodies bag I mean maybe you know look on the tag and",angry
Right. Like I said sometimes a theft and things happen like that but we are willing to reim-reimburse you.,neutral
"Um, so.",neutral
"Theft? Don't you know like all these people that are work - you keep like an eye on them, how can they get away with-",angry
"We have very tight security but we -uh- there are times when we just can't uh make sure there aren't absolutely no human error, you know",neutral
I'm sorry there is no guarantee on baggage.,neutral
you don't realize the stuff that I've got in that - I really need to get the suitcase okay,angry
"I understand, so-",neutral
"all right, We've already checked back here for your baggage",neutral
and we will continue to look for it and because your paper-,neutral
"Well, it's- it's just sort of help with the fact uh that you lost some of your possessions and we rather do that than-",neutral
The airline can't afford to give you everything that is in that suitcase. and so-,neutral
The a- what? Talking about a core they can't afford it? I mean-,angry
Well because lots of people get their baggage lost and we don't want to have false claims or anything like that so we have,neutral
"we can give you fifty dollar to sort of make up for it, to compensate, and we can definitely let you know if it shows up but likely, more than likely-",neutral
I mean you're not helping me here. What do I have to do here? Do I need to sue the airline company is that what I should do,angry
Kathy died last night.,sad
"Oh my God. Oh my God, I'm so sorry.",surprise
"yeah, I mean, you know, it was a -",sad
"I guess we saw it coming and she lasted a lot - a lot longer than, uh, they expected but you know, I mean when it actually happens it's just a lot harder.",sad
"It doesn't make any easier, yes.",sad
"I mean at least she was home, she wasn't in the hospital anymore,",sad
"Oh, man. I'm so sorry.",sad
"She was with- yeah She was with Gary, and he said that she was just sitting there and went to sleep, closed her eyes, and that was it.",sad
"It's going to be so rough, I'm sorry.",sad
"Yes. I mean, it's not as rough on me as it is on him but",sad
"God, it's you know, we've spent so much time with them it's just really surreal, really weird that we're not going to be able to see her anymore and go",sad
Yeah.,sad
"out to- out to dinner you know and do the troops to California, I mean.",sad
Totally.,sad
"It's just that- I don't know, it's sort it's sort- of a weird thing you know",sad
Yeah,sad
"not being able to see anyone again, who knows where they really went, you know. I mean, I guess we can just hope that wherever they are now if it's anywhere that it's better I mean.",sad
"Yes. Well, at least you have a lot of good memories.",sad
She was [garbage],sad
"She really cared about you, you know.",sad
"Yes, I mean she cared about all of us. She was great",sad
so loving everybody you know.,sad
And she was,sad
"Gosh, I just hate I just hate to see her go.",sad
Yeah.,sad
We were all going take a trip to Europe you know.,sad
Even if you still do she'll- she'll be there.,sad
Yes. [BREATHING] God.,sad
Are you going to be okay?,sad
"I just -- I just don't get it, like there is just nothing you can do about it you know, it's like just out of your control and it",sad
"just makes it that much harder to deal 'cause as much as you want to, you know, make her better, see her not in any pain, it's like, just I don't know, just has a mind of its own.",sad
"It's going to be okay, I promise.",sad
"Well, you know I appreciate you coming over and talking to me, I mean it definitely helps",sad
Sure,sad
to talk to somebody but,sad
you shouldn't be alone,sad
"It's just going to take a while, I think.",sad
Yes.,sad
Ah.,sad
Thank you.,sad
Yes.,sad
"Oh, U.S.C.? Oh my Gosh, that's awesome, that was your top choice, right?",surprise
it was you know I wasn't too sure I mean you know it was kind of last minute for like the application,happy
and everything like but,happy
"it was good, yeah. I mean-",happy
No but that's an awesome school. That's so cool.,happy
"Oh, totally totally.",happy
you get to like be a part of that.,happy
"Like you get to be a part of that. Like the, like the- Like a cult.",happy
"[LAUGHTER] like a- like a- [LAUGHTER] No, but I mean like everywhere you go people know who you are.",happy
So you know what you are going to do there?,happy
"What's that? ahh Well, you know I'm I'm thinking um I'm leaning towards like communications",happy
"I-I don't know. Kind of a broad,",happy
"Okay. They have a lot of good schools, right?",happy
"yeah, I mean a lot-a lot of good stuff oh, yeah, I mean it's- it's just a really good school; so really, whatever I pick I can't go wrong. I mean I'm just",happy
"I'm looking forward to getting there. I mean, God, the campus is cool, you know it's like all just very confined I mean just you know it's a college campus you know it's like",happy
"Yes, it's intimate.",happy
I will do the best I can.,happy
"Oh, alright.",happy
"and we'll explore and you going to have such a good time, you're going to fit in so well, it's going to be awesome",happy
So Congratulations. That's awesome.,happy
All right. Customer service this is Steve.,neutral
"Right. No, yes I know. It is-It is a little frustrating.",neutral
"I- I'll give you a little hint, next time if it asks if you're on a rotary phone you know, just stay on the line instead of - instead of hitting one or two to say if you're like on a touch tone",neutral
"pretend like your on a rotary phone, goes straight through to a person.",neutral
I know they don't tell you that kind of thing.,neutral
"Sorry. Okay. Um-, yes",neutral
"Thank you very much. Um So I have a charge on my credit card that, um, isn't mine.",neutral
"Uh, I don't know where it came from and it's actually quite large, and I don't have the money for it so",neutral
"Yea. All right. Well, let me-let me look it up here for a second. Uh, so i think",neutral
"Okay, it was um- at the [GARBAGE] sorry, it was at a department store, I think it was Macy's or something",neutral
"Okay, Alright, yeah. I- I see it on here.",neutral
"All right. Well, you know that's, that's what we have all of our protection plans for and everything like that so I mean it's",neutral
it- it'll work out fine.,neutral
"Yes, we'll get- we'll get rid of it right now. I mean just we're going to have to have you, um, submit something you know, we're going to have to have you mail something in for us, okay.",neutral
"So- So you can um find that application. You have the Internet, you can go to our website.",neutral
Yeah. Yeah. You get the form right now. and- yeah,neutral
"We could mail it to you as well, but-",neutral
"Right. You can go online, print it out, and just fill out the form and um- send it to us um- you know, regarding the grievance and-",neutral
and it'll get taken off um- no problem you know,neutral
Right. I mean we might,neutral
Okay.,neutral
So is there any- I mean what if they spend something again?,fear
"Uh, I mean have you been shopping around on the Internet and stuff? I mean that you gave-",neutral
I did buy one thing on ebay I don't know that might-,neutral
"Uh-ha, I mean usually sites are pretty well protected but sometimes I mean information gets out, so",neutral
so it is a little a little hard in that situation if you want -- you know you can -um- we can- we can issue another credit card.,neutral
"Oh, really?",surprise
"Yeah, yeah. Maybe we'll, uh-",neutral
it's a different number and everything,neutral
Yeah. yeah.,neutral
"Yes, um but for- for that- for that charge we will need you to send something in but we can get you processed immediately for this, for this, for this new card. It still goes to the same address, right?",neutral
