Texto,Emoción
"But, you know, it's like I really love her and I really just -- I can't imagine spending my life with anybody else but her. So, you know, it's like I know that's the right thing. And if you have to, you know, if you have to question that, you know, don't- don't do it. So we're going to do it.",happy
"And it's going to -- the -- you know, I told her that I just -- I want the color brown to be as an integral in the wedding. And, um, maybe some greens and blues.",happy
She's okay with it.,happy
"Well, I mean I just told her--Well I just said, you know, hey, these are my suggestions.",happy
All fruit and the color brown. Just that. That's all- that's my only request.,happy
This is why men don't plan weddings. [LAUGHTER],happy
Yeah. Well maybe--maybe you're right. Maybe there's something to that.,happy
"So, um, anyway, do you want to order now? So, um I mean--",neutral
Well there has to be something you haven't tried.,neutral
What about like a temp agency?,neutral
"Have you gone, like, signed up with a temp agency? Maybe they can help.",neutral
"there's just like no jobs available. I mean, it's just like, God.",neutral
"Right, but you have -- I mean, you have to keep on them. You have to keep calling and reminding them that you're still looking and",neutral
"I mean, you have to be really aggressive about it.",neutral
"Well, I mean, if it's that bad, maybe you're gonna have to take something that doesn't really fit, you know. Like maybe you'll have to do something else for a while. Find a new field, new skill.",neutral
"Well then you're choosing to be unemployed, really.",neutral
"If you're not willing to try and work with it and find something and, you know, I mean, there are things you could do.",neutral
"Well maybe, you know, your luck it is just down and the market for your particular field is down and maybe you just need to look into doing something else for a while.",neutral
"I mean, I'm not saying that you should, you know--",neutral
Excuse me?,surprise
It's my fault 'cause you didn't do what I told you to?,neutral
Well that sounds like your fault.,neutral
You didn't do what I told you to do.,neutral
"Well, I mean, it makes sense, doesn't it, hmm?",neutral
I think maybe you can't get employed because you aren't willing to take responsibility for your own actions.,neutral
That's not true. I take responsibility for my own actions.,neutral
Really? Whose fault is it you don't have a job?,neutral
Yours. I don't--,neutral
[LAUGHTER],neutral
"Hi, how can I help you?",neutral
Mmhmm.,neutral
I'm sorry.,neutral
Right.,neutral
"Uh. Okay. I -- first of all, I'm very sorry you lost your bag.",neutral
"Um, but, actually, our policy is a fifty dollar",neutral
fifty dollars?,angry
refund--coverage of the bag that was lost. yes,neutral
"fifty dollars. No way, no.",angry
"That's our policy, sir.",neutral
"I don't but the thing is, I don't care about your policy.",angry
You understand?,angry
I can't do that.,neutral
"No, no, because, look, I don't care what your policy says. I mean--",angry
You understand that the contents of my bag- The contents of my bag cost a hundred and fifty dollars.,angry
You--,angry
We'll cover fifty.,neutral
No. No. No. What I need you to do -- I need you to write checks for -- I need you to write three of them. That'll be satisfactory.,angry
"Just -- you can fill out the form--We can fill out - no, no, no, we can fill out the form three times.",angry
I'm very sorry. I understand you're upset. You just got off a long flight.,neutral
I understand that. I would know if it was mine. Um-,neutral
"Yeah. If it was yours, but it's not. It's mine. Okay. So just--",angry
But it's not. It's yours. I understand.,neutral
but I need to speak to somebody who can make the three check thing happen.,angry
"I understand you're frustrated, but--",neutral
I know. I understand it's personal-- It's personal to you. I get that.,neutral
Please.,angry
"I'm already calm. Okay, I'm calm. I'm calm.",angry
"Yeah. If you were really sorry, you'd give me the three checks.",angry
"So why don't we just do that and stop this nonsense, hmm? Hmm?",angry
"Hey, how you doing?",sad
I'm sorry.,sad
Thanks.,sad
"I know- I know there's nothing I can say that will really help, but--",sad
"I know. I just -- I don't know. It's just weird because you have somebody who's, you know,",sad
a major part of your life and then they're gone. And I don't know. That's not really -- it's never really happened to me before.,sad
I'm sorry. It's never easy.,sad
Yeah.,sad
"But, I'm here if there's anything you need. I mean, you just have to ask. I know --",sad
Thanks.,sad
--it doesn't really do anything. But--,sad
I just -- it's just not fair.,sad
I know. It never is.,sad
"How's, um -- how's his parents doing?",sad
"I mean, they're, you know, they're upset. It's like you know, they",sad
feel the same way everybody else does.,sad
"I mean, what do you want to do? Do you want to- do you want to talk about it? Do you-",sad
"[BREATHING] I mean, there's nothing really to talk about. He's gone and I'll never see him again.",sad
"Well I know it's not a lot of help or anything, but at least you got to know him. I mean, at least you had the time with him that you did.",sad
Yeah.,sad
"I mean, we can be grateful for that.",sad
"Yeah, I don't know. Sometimes I wish I didn't know him. So I wouldn't--",sad
You feel that way now because you're upset. But you don't really think that.,sad
"It'll get better. I know it doesn't help, but it will get better and you will remember all of the good things that you guys had; all of the memories that you have with him that were happy and you'll be grateful for those.",sad
This is just -- this is a terrible life. I just don't understand.,sad
"I mean, it's just not fair. Like, I don't know. Why people -",sad
"there should just be some sort of rule that people don't die until they're older, 'cause then, at least, it's expected.",sad
"I agree. If I knew how to make that happen, I would certainly help you.",sad
I don't know what to do.,sad
"When's the service? Can- can we help? Is there anything, I mean--",sad
"I mean, you- you can go. I don't know. I don't know what else.",sad
I hope it rains. Somehow that'll make me feel more comfortable.,sad
"Seems like if the whole world's sad, then it's okay for you to be.",sad
Yeah.,sad
I just wish there was some way to just bring him back to life magically.,sad
I know.,sad
"Just, you know, some thing; some genie. I need to find a genie bottle.",sad
"I don't have any magic answers. But,",sad
"I mean, as- as cliche as it is, as long as people who loved him remember him, then it's not a waste, you know.",sad
I know.,sad
"What, no way.",surprise
Really?,surprise
"Yeah. I like to know about history, 'cause, you know, it's- it's just so relevant to the present.",happy
Yeah.,happy
"And, uh-",happy
"Um, you know, I don't think so. But I think that, you know, it's still a private school",happy
"and right you know it's still- and then, you know, I mean-",happy
"I'm guessing, you know it's like I I checked it out. And, like, they have a decent history program.",happy
"So -- and like the geology just is awesome. It rocks, no pun intended. [LAUGHTER]",happy
"Oh, you did not just say that.",happy
"Ouch. That's, um -- oh, wow.",neutral
"No, no, I mean, I didn't know -- I didn't know that about you. Um, I feel like --",neutral
"The -- what, the- I mean--",neutral
I'll go to basketball games.,neutral
"Okay. Well that's cool, too, but like--",neutral
Maybe some golf matches.,neutral
I don't know. Do they have golf? Do they have- Does U.S.C. have a -- I don't know if they have a golf team.,neutral
"No, I'm not going to go to a football game.",neutral
Forget it. Forget it. Forget it. No way.,neutral
I do -- I will need to get a gun-,neutral
"Okay. Um, but, no, I, uh, I do need to get a gun soon, though, 'cause I mean",neutral
Excuse me?,neutral
I need to get like a -- just a small little gun just 'cause -- or like a taser or something or just like a butterfly knife,neutral
No.,neutral
"'cause, you know, I mean, it's like If I ever want to go south of campus",neutral
Well I need to defend myself from,neutral
Are you sure you didn't make them?,neutral
Okay.,neutral
"Umm, Miss Aruckman",neutral
I am seeing the two hundred dollar charge.,neutral
So you're saying that you didn't make these calls.,neutral
All I can do for you right now is give you a hundred dollars.,neutral
What I can,neutral
What I can do for you is give you a hundred dollars right now and fill out complaint form,neutral
which you- which you'll have to go into a local Verizon dealer-- or Sprint.,neutral
A few weeks. You won't even know that they were there.,neutral
Really?,surprise
"Yeah. That's fine. I just -- that's fine. Yeah, I mean, it doesn't make any difference to me. I mean, it's not like it's going to cost my job or anything.",neutral
You're just going to put it back on my account.,neutral
"I mean, technically, that's policy. But, like, I mean, I don't really care about -- nobody really cares about policy here.",neutral
So you're just going to take care of this for me?,surprise
Sure.,neutral
"Oh, my God, thank you so much.",happy
You're welcome.,neutral
"I really appreciate this. I know it's not policy or whatever but, seriously",happy
"No, no, no, it's cool. It's cool. It's cool. So, um",neutral
make my life a lot easier.,happy
"You know, so- I mean, are you doing anything later? Or um",neutral
Really?,surprise
"Oh, I don't know. I mean, I don't know. I just thought, you know, maybe you want to get some co--I mean, I'm actually -- wait, where do you live? Oh, you're in Los Angeles, I see. Oh, no, that sucks 'cause I'm in, actually in Alabama.",neutral
"God, that's like a whole problem with like-- But, no, I mean, hey-- if you ever",neutral
"if you ever come out to Montgomery, I mean, you know, just -- just call up, you know, call up the operator and I'll-- I'll be here. So, um.",neutral
I'll,neutral
"call up the Sprint call center and, uh, you know. cool",neutral
Alright. Take Care.,neutral
You too.,neutral
What's he going to say? Maybe we ought to tell him before he sees it.,neutral
He saw it.,neutral
He was out here when it broke.,neutral
When?,surprise
He's getting just like after he died. What's the meaning in that?,sad
What?,surprise
You can't say that to him.,angry
We've gotta say it to him.,angry
How are you going to prove it? Can you prove it?,angry
"For God's sake, three years. Nobody comes back after three years. It's insane.",angry
"To you it is and to me, but not to him. You can talk yourself blue in the face, but there's no body and no grave, so where are you?",angry
Why?,neutral
Going to ask her to marry me.,neutral
"Well that's only your business, Chris.",neutral
What do you want me to do? You're old enough to know your own mind.,angry
Well you want to make sure your father isn't going to have --,neutral
"Well, then you know it's not only my business.",angry
"Sometimes you infuriate me, you know that? Isn't it your business, too, if I tell this to father and he throws a fit about it? You have such a talent for ignoring things.",angry
I ignore what I got to ignore. The girl is Larry's girl.,angry
"From father's point of view, he's not dead. And you have no right to take his girl.",angry
I wanted to get this settled first.,neutral
How do you know she'll marry you? Maybe she feels the same way father does.,neutral
"The trouble is, you don't see enough women. You never did.",neutral
I don't see why it has to be Annie.,angry
"Alright, then, mom. Did we skip something? No. Alright, then, mom.",neutral
Yes we did. Do you want to keep going?,neutral
"Yeah, let's keep going.",neutral
Just give it some more thought.,neutral
"father forgot about Larry, we'd have a regular wedding and everything happy. If I can't get that here, then I'll have to get out.",sad
What the hell is this?,angry
Are you crazy?,angry
You've got a business here. What the hell is this?,angry
The business? The business doesn't inspire me.,angry
Must you be inspired?,angry
"Yes. I like getting an hour a day. If I have to grub for money all day long, at least at evening, I want it beautiful.",angry
"Yes, on this I would.",neutral
You don't want to think like that.,angry
Then you help me stay here.,neutral
"Alright. But just don't think like that because what the hell did we work for? That's all for you, Chris. The whole shooting match is just for you.",angry
"But don't think that way, you hear me?",angry
Why did he invite her here?,angry
"Oh, God, line.",neutral
Why does that bother you?,neutral
"She's been in New York three and a half years. Why, all of a sudden--",angry
Nobody comes seven hundred miles just to see.,angry
He's not going to marry her.,angry
How do you know he's even thinking about it?,neutral
It's got that about it.,angry
Well so what?,neutral
"What's going on here, Joe?",angry
Line.,neutral
"Now listen, kid. Now, listen.",neutral
"She's not his girl, Joe. She knows she's not.",angry
"Then why is she still single? New York is full of men. Why hasn't she married? Probably a hundred people told her she's foolish, but she's waited.",angry
"Because she knows what I know, that's why. She's faithful as a rock. In my worst moments, I think of her waiting and I know, again, that I'm right.",angry
"Nobody in this house dares take her faith away, Joe. Strangers might, but not his father, not his brother.",angry
"I want you to act like he's coming back, both of you. Don't think I haven't noticed you since he invited her here. I won't stand for any nonsense.",angry
"Because if he's not coming back, I'll kill myself.",angry
Laugh. Laugh at me. But why did that happen the very night that she came here?,angry
She goes to sleep in his bed and his memorial breaks in pieces. Look. Look at it. Joe--,angry
"Believe with me, Joe. I can't stand all alone",angry
"You, above all, have got to believe. You.",angry
I can't help it.,sad
"What have I got to hide? What the hell is the matter with you, Kate?",angry
Every day since.,happy
"I was waiting for you, Chris. 'Til then, you never wrote and when you did, what did you say? You sure can be ambiguous, you know.",happy
I'll never forgive you. Why did you wait all these years? All I've done is sit around and wonder if I was crazy for thinking of you.,happy
"Yes, I suppose there has been. But it's going from me.",sad
I don't know where to start.,sad
"It's all mixed up with so many other things. You remember overseas, I was in command of a company?",sad
Well I lost them.,sad
How many?,sad
Just about all.,sad
"Oh, gees.",sad
It takes a little time to toss that off because they weren't just men.,sad
"For instance, one time it'd been raining several days. And this kid came to me and gave me his last pair of dry socks; put them in my pocket. That's only a little thing, but that's the kind of guys I had.",sad
"And I got this idea watching them go down, everything was being destroyed, see? But, to me, it seemed there was one new thing that was made,",sad
a kind of responsibility. Man for man. You understand me? And then I went home and it was incredible.,sad
"There was no meaning in it here. The whole thing to them was some sort of bus accident. Then I went to work for dad and that whole rat race again. I felt, what you said, ashamed somehow",sad
because nobody was changed. It seemed to make suckers out of a lot of guys. I felt wrong to be alive;,sad
"to open that bank book; to drive the new car; to see the new refrigerator. I mean, you can take these things out of a war, but when you drive the new car, you have to know that it came out of the love a man can have for a man.",sad
"You have to be a little better because of that. Otherwise, we have is really loot and there's blood on it. I don't want to take any of it. I guess that included you.",sad
"Annie, Annie, I'm going to make you a fortune.",happy
What'll I do with a fortune?,happy
Fine.,neutral
It's not yours.,angry
Whose is it?,neutral
"It's ours. It's mine, too.",angry
You kept saying my flashlight as if it's somehow just yours. How is that supposed to make me feel?,angry
Yes.,angry
"Are you cold? Do you want my jacket? We should have brought the blanket, our blanket.",neutral
You want my jacket?,neutral
It's after eleven; let's go home.,angry
There is no point in coming down here.,angry
Right.,neutral
"That's my point, too.",neutral
So let's go home.,angry
I just don't. It's stupid.,angry
"Pass up what? These little fish swim onto the beach, flop around and then they swim away. And then they die.",angry
What are you so excited about?,neutral
For real?,surprise
Yes.,angry
"Last year, you will also remember, our shoes got wet. I got sand in my panties. We got into a big fight over nothing. You got a sore throat and we did not see the grunions.",angry
"Look at this, goose bumps.",neutral
Well so what'd you think?,neutral
What I said.,neutral
"Goddamn it, Augie, don't ask me that. I hate it when you ask me that. You always ask me that. It's insulting.",angry
Well what's bugging you?,angry
We just have different ideas about what this evening is supposed to look like.,angry
"There's nothing to it. We come down here. The grunions arrive. They do their little fish business. We go ooh, ah, look at the fish. They go home. We go home.",angry
"We never do, do we? Have we ever?",angry
"I did want to see it. I always do. I keep thinking this time will be the time, but it never is.",angry
"It was about four years ago, right after we got married. We thought I was pregnant and we had a bottle of champagne but no glasses. You asked me to dance. So we took off our shoes and you popped the cork.",sad
"Wait a minute, I've got it.",neutral
Dancing barefoot in the sand; drinking champagne from the bottle.,sad
"It was in the car, right? Driving past the Knickerbocker Liquor Locker? You said let's get some champagne and I said times a wasting or something like that. Right? That's it, right? You want this to be like the other time. That's it. Of course.",neutral
I'd rather not remember some things. I'd rather not hope for some things.,sad
No.,sad
No.,sad
No.,angry
I want something to turn out the way it's supposed to.,angry
"Well welcome to the human race. You think this is what I had in mind? You think that when I proposed, I had this great fantasy going that four years down the line, we'd come to the beach and yell at each other over fish? No.",angry
"And we'll have three fat rosy kids and ha, ha, ha, baby, the joke's on us, 'cause you know what you get, Carla? You know what you get? This.",angry
This what? What is this? This isn't even anything.,angry
"Oh, right, sure. This is standing on the beach. This is waiting. This is fighting.",angry
But this isn't anything like I thought anything would be like.,angry
"No, I know, me neither.",angry
I didn't say that.,sad
"No, I know. But still. I know I don't make you happy.",sad
Yeah?,surprise
"Actually, now that you mention it, no. I don't.",happy
"Okay, fine. So we're in the wrong spot, but we're with the right person.",happy
"I don't know. It seemed like a good spot to me. I mean, look at the view you've got of the moon from here.",happy
"Yeah, I noticed that. Looks pretty on the water, doesn't it? Big ol' white moon. I'm sorry, Augie.",happy
"Shh. If we're very quiet, the fish might come.",happy
Good God.,fear
I wonder.,fear
"Nobody knows we're here, except Freda and she wouldn't ring up.",fear
"It must be them, then.",fear
What are we to do?,fear
"We'll be alright, darling. Whatever happens, aren't we?",neutral
"Meaning that sacred and beautiful thing, love?",neutral
"You mustn't be serious, my dear. That's just what they want.",neutral
All the futile moralists who try to make life unbearable. Laugh at them. Be flippant. Laugh at everything. All their sacred shibboleths. Flippancy brings out the acid- acid in their damn sweetness and light.,angry
"If I laugh at everything, I must laugh at us, too.",neutral
No. That fire will fade along with our passion.,sad
Horrible thing. I hated it.,angry
Line?,neutral
"As a matter of fact, the real cause of that row was Peter Burden.",neutral
That was the first time you ever hit me.,angry
I didn't hit you very hard.,neutral
"The manager came in and found us rolling about on the floor, biting and scratching like panthers. Oh, dear.",happy
"How ridiculous. How utterly, utterly ridiculous.",happy
And very much sillier.,happy
"You must admit that he was in love with you, wasn't he?",angry
"Just a little, perhaps, nothing serious.",happy
Line?,neutral
Let him kiss you.,neutral
You let him kiss you. You said you did.,angry
What of it?,angry
What of it?,angry
What about me?,angry
"That's a nice point of view, I must say.",angry
So am I; bored stiff.,angry
"No, thanks.",angry
It's become a habit with you.,angry
"Really, Amanda",angry
What?,angry
Nothing.,angry
"Going out somewhere, my dear?",angry
"As a matter of fact, that's perfectly true.",angry
"Oh, no, it isn't.",angry
"Yes, it is.",angry
"Oh, be quiet.",angry
Line?,neutral
It's a pity you didn't- It's a pity you didn't have more brandy.,neutral
It's a pity you didn't have any more brandy. It might have made you a little less disagreeable.,angry
Line?,neutral
"Snap. Oh, snap, snap, snap, like a little adder.",angry
"Adders don't snap, they sting.",angry
"They -- nonsense, they have a little bag of venom behind their fangs and they snap.",angry
They snap.,angry
I don't care. Do you understand? I don't care. I don't mind if they bark and roll about like hoops.,angry
"Yes, I did, quite a lot.",angry
"I suppose you let him kiss you a good deal more then, hmm?",angry
Mind your own business.,angry
You must have had a riotous time.,angry
"No restraint at all, very enjoyable. You never had much anyhow.",angry
You're quite insufferable. I expected it's because you're drunk.,angry
I'm not in the least drunk.,angry
You always had a weak head.,angry
"On the contrary, a child of two could get violently drunk on only one glass of brandy.",angry
Very interesting. And how about a child of four and a child of six and a child of nine?,angry
"Oh, shut up.",angry
"Not very funny, dear. You'd better have some more brandy.",angry
Very good idea. I will,angry
You better turn that off I think.,angry
Why?,angry
There aren't any people upstairs. It's a photographer's studio.,angry
"There are people downstairs, I suppose",angry
"Turn it on again, please.",angry
"Very well, if you insist on being boorish and idiotic.",angry
Turn it off. It's driving me mad.,angry
Go away. Go away. I hate you.,angry
Turn it off.,angry
You are far too temperamental. Try to control yourself.,angry
We swapped. Listen.,neutral
Listen--,angry
"Listen, indeed. I am sick and tired of listening to you, you damn sadistic bully.",angry
"You're a vile tempered, loosed living",angry
Stop.,angry
wicked little beast. And I- I hope I never see you again as long as live.,angry
Stop. I hate you. Do you hear me? You're conceited and overbearing and utterly impossible.,angry
"This is the end. Do you understand, the end? Finally and forever.",angry
You're not going like this.,angry
"Oh, yes, I am.",angry
"No, you're not.",angry
"Let go of me. You're a cruel fiend and I hate and loath you. Thank God, I discovered in time what you're really like.",angry
Shut up. Shut up.,angry
"You're a mean, evil minded",angry
Marry you again? Huh.,angry
little vampire And I hope to God I never set eyes on you as long as I live.,angry
"Never, never, never. I'd rather die in torment. Beast brute.",angry
Whore.,angry
Swine.,angry
"Hi, I need an ID.",neutral
"ahh Yeah, this is the wrong line. I'm sorry. You need to go back over to line two B. That's where you should have started from.",neutral
"Well, I have no camera here. I can't help you at all here, ma'am. I have forms for something completely different. You need to go to a different place.",neutral
"So could I maybe get the form from you, fill it out here- and maybe you could-",neutral
Isn't there anything you can do? Just call over and ask them if I can go to the front of the line in the other line.,angry
Why not?,angry
"Right, well, last time they told me, it was this line, and obviously, it's not true.",angry
What is it?,neutral
um.,sad
I'm sorry. It's just a lot ahh to explain. ahh I got a call--,sad
"I got a call today,",sad
I'm going to need to go overseas for a while.,sad
You got called up.,angry
Iraq.,fear
I thought you said this wasn't going to happen for at least a year.,angry
"I don't know ""sigh"".",sad
I know. I know.,sad
"I know. Well, we'll have to figure all that out. I mean, I think the Army's going to provide childcare and help us out with that. um.",sad
Where do you have to go? Where are you going?,angry
Iraq.,sad
I think infantry. I'm not sure.,sad
I don't understand why they would just do something like this?,angry
It doesn't make any sense. It's stupid. I told you you shouldn't go in the Army.,angry
"Your Your mom, you want me to move in with your mom?",surprise
I don't think there's anything we can do.,sad
I'll tell them I'm sick and that you can't leave something.,sad
It's not fair.,sad
I know. I know it's not fair.,sad
Why has to be you? There's all those other people. Somebody else can go instead. It's not right.,sad
"Well, apparently nobody else can go.",sad
I understand. I'm worried about you. I don't know what's going to happen to you.,sad
I know.,sad
I know.,sad
I jus-,sad
We'll figure something out. We just have to ... we just have to think about this. Could any of your family help us?,sad
I don't know.,sad
Yeah. I guess. I don't know what they're going to say.,sad
"Yeah, we'll call them. We'll figure something out. I'm sorry, I'm sorry, I'm sorry. You're right.",sad
I'm going to miss their first words.,sad
I know.,sad
You'll have to send me pictures and letters everyday.,sad
"All the time, every day, every day. They have e-mail over there and stuff like that, right? I can send you pictures.",sad
"Yeah, as much as I can.",sad
"""sigh"" Three weeks.",sad
