Texto,Emoción
Excuse me.,neutral
Yeah.,neutral
Is there a problem?,neutral
Well what's the problem? Let me change it.,neutral
That's out of control.,angry
I don't understand why this is so complicated for people when they get here. It's just a simple form. I just need an ID.,angry
"Clearly. You know, do you have like a supervisor or something?",neutral
Yeah. Do you want to see my supervisor? Huh? Yeah. Do you want to see my supervisor? Fine. I'll be right back.,angry
Did you get the mail? So you saw my letter?,sad
Yeah. I know.,sad
"I don't understand. You've already done so much, I don't know why do you have to go back.",sad
I don't know. I put in that. request too. They didn't...,sad
"I guess, you know, everybody has to make sacrifices.",neutral
"There's people that have given more though, you know?",sad
I know.,sad
"There's babies over there, though, that need mothers.",neutral
I don't know how you can be okay with this? I don't know why you're not-- you're fine with it.,sad
"Just, you know, kicking myself.",sad
things just aren't what they seem.,sad
I just don't see why it has to be you.,sad
"If not me then, who?",sad
What am I going to do? Huh?,sad
"You'll videotape everything, yeah?",sad
Yeah.,sad
"Maybe you can send it to me, like stream it, yeah?",sad
Don't you guys have access to computers over there.,neutral
Last month-- Yeah.,sad
I just don't know how I'm going to do it without you.,sad
I have to find sitters.,neutral
I can't raise a baby by myself. How?,sad
"We've got friends, that's why we moved here, huh? Because there is a day care down the street.",sad
I know.,neutral
And your mother is close by.,neutral
I'll send you lots of letters.,sad
And I want lots and lots and lots of pictures.,sad
So what's up? What's new?,neutral
Well Vegas was awesome.,happy
Yeah. I heard.,neutral
"And, um, I got married.",happy
Shut up. No- in Vegas?,surprise
Yeah. In the old town part.,happy
Um- Yes. It was very romantic.,happy
It was at the slot machines.,happy
"Uhuh, uhuh. He won big and he-and he realized that the only thing that would make it better was me as his bride.",happy
He turned to you and was like...,neutral
[LAUGHTER] That's really romantic.,happy
"Yeah. Well. You know, because he's leaving the next day.",happy
Yeah.,neutral
But we're going to have a honeymoon cruise.,happy
"Does that mean that you're going to get citizenship, too, in- in England or whatever?",neutral
Oh. I hadn't even thought about that.,happy
Yeah. But he'll have like a long visa. Can you go visit then for a long time?,neutral
Oh. Totally.,happy
I guess I'll- I guess I'll have an internet husband.[LAUGHTER],happy
Like you need another one of those.[LAUGHTER],happy
Is that your phone?,happy
He loves you.,happy
"He likes to keep tabs, you know.",happy
How much did he win at the slot?,neutral
"Uh, I think seven hundred and fifty dollars.",neutral
Really? Penny slots?,surprise
Penny slots. That's what he plays.,neutral
Wow.,surprise
Yeah.,neutral
I'm a big fan of the Wheel of Fortune quarters. But it just costs so much. I don't know.,neutral
Yeah. We played Wheel of Fortune pennies. It's like a giant thing with like-,happy
"But the pennies always get you because you end up spending like, you know, fifty bucks.",neutral
Fifty bucks. Mmhmm.,neutral
"like, wait, but it's just pennies. You're like, wait a minute I'm on to you.",neutral
Yeah.,neutral
Well so now we're married. We have cat children.,happy
[LAUGHTER] Cat babies.,happy
"We renamed Brenda, Lumber Janet.",happy
That's fair enough.,neutral
She needs a new name each state that we go into. [LAUGHTER],happy
"Have you tried, uh, Craig's List?",neutral
"Uh, what? Craig's List? Oh the internet thing?",neutral
Yeah.,neutral
I don't know. Isn't that-- that's all like escort services and things like that.,neutral
No. There's regular jobs on there.,neutral
Uh huh.,neutral
I'm just saying I have a friend that got a good job on it so I was just recommending it.,neutral
He's like a manager for a theatre.,neutral
He's like a house manager. Yeah. It's a good job.,neutral
He just...,neutral
you know what? I heard about that job. I applied for that.,neutral
You did?,neutral
Yeah.,neutral
You've been looking for a job for a long time; that was a long time ago. Right?,neutral
Yeah.,neutral
Hmm.,neutral
I don't know. He had a really good resume I guess and--,neutral
Yeah. Do you have a resume?,neutral
It's kind of helpful when getting a job.,neutral
I just- I mean I call people up and I tell them what I'm good at.,neutral
Well maybe we should sit down some time and you can just tell me all the stuff that you have done and I'll write it out.,neutral
Yeah.,neutral
"No. You can- or you can just bring it in person. But they need, generally, something to see, you know, what kind of what that you've done, what kind of--",neutral
"Yeah. But the piece of paper helps, too.",neutral
"No. But it has an outline, you know.",neutral
"I know. Okay. Well, um. Maybe--",neutral
Yeah.,neutral
"Okay, yeah. I would imagine.",neutral
"Well, sometimes you have to do things that you don't necessarily like to do to have a job. But the job affords you money, you won't have to be taking the bus right now.",neutral
maybe get a car.,neutral
"I just, you know, think you should try a little harder maybe.",neutral
I didn't say that.,neutral
"I am riding the bus, but by choice.",neutral
"To save the environment, carpool.",neutral
Yes. One less car at a time.,neutral
Mmhmm.,neutral
I'm not frustrated.,angry
Who do you think you are?,angry
I don't think I'm anyone.,neutral
You are so high and mighty. I just--,angry
I- I-I didn't-- okay.,neutral
Oh. I'm saving the environment. I'm riding this car because I- I want to.,angry
"The bus, I'm riding the bus because I want to.",angry
I can not-- you are not here by choice. Nobody would ride this bus by choice.,angry
Hi. Thanks for waiting.,neutral
Can I help you?,happy
Uh huh.,happy
Okay.,neutral
Okay.,neutral
Okay. Great. I'm really sorry that you had to do that. What's your last name? Let's start there.,neutral
Okay.,neutral
all right- okay. And you lost your bag? Is that- that the issue?,neutral
Flight seven fourteen.,angry
Uh-huh.,neutral
"Am I going to be getting, like, free tickets, free mileage. When can I expect my bag here?",angry
"Yeah. Yeah, I don't see- I don't see any--",neutral
"I don't see any record of it, and I-usually when I don't see a record of it, that means um-",neutral
"we've mistakenly lost your baggage. We're very sorry. On behalf of Jet Blue I would like to apologize for any inconvenience. I am allowed to issue you a fifty dollar gift card which you can use any future flights you want to take with us. I'm very sorry, once again...",neutral
"for such an inconvenience and your bag, but",neutral
Is this a joke?,angry
Yeah.,neutral
"No, no.",neutral
"Are there candid cameras? Is this that movie? There's that show, right? Airplane, airline.",angry
"No, no. This is real.",neutral
"No. I'm just giving you money, the bag is gone. If it's not here, I'm really sorry there is nothing I can do because...",neutral
this is the only track record that we have and if it's not listed here then it's probably not anywhere.,neutral
"You're kidding me, this is a joke.",angry
Do you have any idea-- fifty dollars? That's supposed to replace everything that I have? Do you understand how much I have packed in there? Not only does it have sentimental value; it can't be replaced like that. It was incredibly expensive.,angry
Yes.,neutral
I know.,neutral
We flew in from Paris. I've been shopping for three weeks.,angry
I don't care what you're freaking sign says. Somebody- Somebody needs to replace everything I've got there and give me money for my inconvenience.,angry
Okay. Calm-,neutral
"Actually, we are not necessarily liable to give you- to even give you this fifty dollars so... it's actually- it's actually really",neutral
Do you understand who my husband is?,angry
"If you're- if you're- if you're looking for a lawsuit, baby, you've found it.",angry
"We are actually not even allowed-- you know, like we don't have to give you this fifty dollars. We don't have to do that.",neutral
Oh-Oh. It's a gift. You're-You're helping me out here?,angry
It's a gift.,neutral
"You know, the airlines can not be held responsible for every bag of luggage that comes through here.",neutral
You are cruising for a bruising. You are in so much trouble.,angry
With the amount of--,neutral
Who's in charge? Who is the president of Jet Blue?,angry
"Um, actually, I don't know. I don't know. Oh really?",neutral
Because I probably know him.,angry
Yeah.,angry
Well then maybe you can just call him and he can give you more money. But right now all I can do--,neutral
"I don't want money, I want my clothes.",angry
"Right now all I can do is just give you this fifty dollars, I'm really sorry.",neutral
What's your name?,angry
Oh. My name is Sean. Hi.,neutral
"Badge number? Uh, no. You can just take my employee number I guess.",surprise
Okay. I'll do that.,angry
Why? Have I done something wrong? Have I given you bad service? I feel like I have done the best I could.,surprise
I don't think you have done everything you could do because I don't have my bag here yet.,angry
"If you want, you can write a letter. I can give you the address. Yes. An angry--",neutral
A letter? I'll make a personal phone call.,angry
"Or you can make a phone call. But I think a letter might be a little more-- in my impression, letters have more...",neutral
"I'm sorry, Joy.",sad
Is there anything I can get you? Do you want me to take care of anything for you or...?,neutral
...pick up anything?,neutral
No.,sad
You know you are welcome to stay at my house if you want to just check out for a couple days and hang out.,sad
That's sweet.,neutral
Thank you.,neutral
I went to see her headstone a week or two ago.,sad
"I used to go to cemeteries a lot before she died. I just, you know, I felt like they were urban oasis, you know, there is always this green in the city.",sad
Hmm.,neutral
So I was like wandering around before. It takes forever to find her headstone; I always lose it. You know.,sad
So I was looking at this other one and there was like a piece of candy there and I thought that I would take the candy and put it on her headstone. And-,sad
"this woman came up and, you know, it was hers. It was her person that was there.",neutral
Oh. She was there?,neutral
"Yeah. And she was like, that's pathetic, I hope you enjoy it.",sad
"And I, you know, I mean, I said I was sorry and I brought it back to her kind of and I like put it on the ground and she was like, no, it's fine. She was like, I would rather have her back, honestly.",sad
Mmhmm.,neutral
"I don't know. It just, like, I felt so bad because I shouldn't have done it. I don't know. Whatever.",sad
Yeah.,sad
I don't know.,sad
How long were you there for?,neutral
At the cemetery?,sad
Mmhmm.,neutral
couple hours.,sad
"I brought- I brought Chuck with me. He went to Redlands, yeah, for the day. We ran through the sprinklers.",neutral
Oh really?,neutral
You ran through the sprinklers in the cemetery?,neutral
Is it a big cemetery?,neutral
Yeah. It's huge. Redlands is an old city so they have lots and lots of stones.,neutral
"Oh, so they're like really old too, really old ones?",neutral
Yeah.,neutral
"It's weird. Whenever I go back to town, I think of her. I mean, it's like ... I mean we grew up together and she died when we were twenty one. And yeah. She had cancer, she had two brain tumors.",sad
"My best friend Heather. She's got a- we have a- we built this like little-- There's a park, Prospect Park. And there is like a garden section of it that we set up for her.",sad
She used to have these poetry parties on Memorial Day.,sad
Mmhmm.,neutral
Umm. Yeah.,sad
"And the last time before she died, I remember she couldn't really stand, umm...",sad
"But I mean she could, but it was- so it was kind of sitting at her feet holding her up and she had these poems she had memorized. And I remember looking up, she had curly red hair and there was this palm tree right behind her and it was like a crown growing right out of her head. It was cool.",sad
Mmhmm.,neutral
"Some, I guess. She memorized this one, John Dunn, it's called, Death Be Not Proud. and-",sad
So she wrote a lot of poetry?,neutral
"There's another one, I can't remember.",neutral
"I remember, too, when we were-- she died at U.C.L.A. She had brain surgery and there was not much hope to begin with, but I gave blood for her surgery, her mom and I before, so we dropped her off in the waiting room and then we were giving blood and came back. And she, in her wheelchair, like can hardly do anything, reciting her poetry for these people like in the waiting room. All she needs is a God damn audience. You know?",sad
Is this a Masters or a P.h.D.? Or can you...? Nice,neutral
"That's good. Don't you have to like teach a class, too, when you do that?",neutral
"Of course, right. That's where the real money is, being a student.",neutral
That's how you get the big bucks. Are you messing with the chair? Don't ruin it.,happy
He saw it.,neutral
How could he see it? I was the first one up; he was still in bed.,surprise
He was out here when it broke.,neutral
Four o clock this morning. I heard a crack and I woke up and looked out. He was standing right over there when it cracked.,neutral
I don't know.,neutral
"He's dreaming of him again, walking around.",neutral
I guess he is.,neutral
You know Larry is not coming back and I know it. Why do we allow him to go on thinking that we believe with him?,neutral
We've got to say it to him.,neutral
"Sit down, Mom. I want to talk to you.",neutral
You know.,neutral
"Well I got an idea, but what's your story?",neutral
I'm going to ask her to marry me.,neutral
You know it's not just my business.,neutral
"So all right then, I'll just go ahead with it?",neutral
"You know sometimes you infuriate me. you know that? Isn't it your business if I tell father and he throws a fit about it? God, you have such a talent for ignoring things.",angry
I wanted to get this settled first.,neutral
"Well if she does, then that's it. That's the end of it. From her letters, though, I think she's pretty much forgotten him.",neutral
And then we'll thrash it out with father. Okay Mom? Don't avoid me.,neutral
Just give it some more thought.,neutral
What the hell is this?,angry
"I'll get out. I'll get married and I'll move somewhere else, maybe New York.",neutral
You have a business here. What the hell is this?,angry
Oh. Must you be inspired?,angry
"On this, I would.",neutral
Then help me stay here.,neutral
"All right. But you don't want to think like that because what the hell are we working for, Chris? It's all for you. This whole shooting match is for you.",angry
Just don't think like that.,angry
Well maybe...maybe he just wanted to see her.,neutral
He's not going to marry her.,angry
How do you know he's even thinking about it?,neutral
It's got that about it.,angry
"What is going on here, Joe?",angry
She is not his girl. She knows she's not.,angry
"Then why is she still single? New York is full of men, why is she still single? Probably a hundred people told her she's foolish, but she waited.",angry
How do you know why she waited?,neutral
"Because she knows what I know, that's why. She's faithful as a rock. In my darkest moments, I think of her waiting and I know that I'm right.",angry
"Nobody in this house dares take away her faith, Joe. You know strangers might, but not his father, not his brother.",angry
"I want you to-- I want you to act like he is coming back, both of you. Don't think I haven't noticed you since Chris invited her here.",angry
I won't stand for any nonsense.,angry
"Because if he's not coming back, I'll kill myself. Oh laugh, laugh all you like but why does this happen the very night he comes back. She goes to sleep in his room and his memorial breaks in pieces. Look at it, Joe, look.",angry
"Just believe with me, Joe. Only last week a man came back in Detroit missing longer than Larry. Believe with me. You, above all, have got to believe. Just believe.",angry
"What have I got to hide? What the hell is the matter with you, Kate?",angry
You're the only one who still loves his parents.,neutral
"I know. It kind of went out of style, didn't it?",neutral
It's not so bad; it's a good thing.,neutral
"[BREATHING] You know, it's lovely here. The air is sweet.",neutral
You're not sorry you came.,neutral
"I'm not sorry, no. But I'm...I can't stay.",neutral
"For one thing, your mother much as told me to go.",neutral
Well.,neutral
"And then, you. You've been kind of...",neutral
What?,neutral
Sort of embarrassed ever since I got here.,neutral
Well I was kind of planning of sneaking up on you over the course of a week or so. They just take it for granted that we're all set.,neutral
I knew they would.,neutral
"Well sure, from your mother's point of view. Why else would I come?",neutral
"I, umm. I guess, I guess that's kind of why I came.",neutral
[BREATHING],happy
"I love you. Annie, I love you.",happy
[LAUGHTER],happy
"I don't really have any imagination, that's all I know how to say.",happy
[LAUGHTER],happy
"Am I embarrassing you? Are you - See, I didn't want to do it here with this yard, on this porch. I wanted it to be somewhere new, some place fresh for both of us.",happy
No. No,happy
"Chris, I've been ready a long, long, time.",neutral
I almost got married two years ago.,neutral
You started to write me.,neutral
You felt something that far back?,surprise
Every day since.,happy
Why didn't you let me know?,happy
Give me a...,happy
Give me a kiss.,happy
beating around the bush.,happy
"I will never forgive you. All I'd done was sit around wondering if I was crazy waiting so long, wondering if you were thinking about me.",happy
"Oh Annie, we are going to live now. I am going to make you so happy.",happy
Not like that you're not.,happy
I kissed you.,happy
"Like Larry's brother. Do it like you, Chris.",neutral
"Hey, let's drive some place. Huh? Let's get out of here.",sad
No it's nothing like that. It's-,sad
Yeah. I suppose I have been. But it's going from me.,sad
I don't even know how to start.,sad
"It's just all mixed up with so many other things, you know? You know overseas I was in command of a company?",sad
"Yeah, sure.",neutral
Well I lost them.,sad
How many?,neutral
Pretty much all.,sad
"Aw, geez.",sad
You can't just toss off a thing like that because they weren't just men. You know?,sad
"Like for instance, there was this one time it had been raining for several days and this kid he just came up to me and he gave me his last pair of dry socks. He just put them in my pocket. That's a little thing, you know, but that's what kind of guys I had.",sad
"They didn't die, they killed themselves for each other. I mean that, exactly. Just a little more selfish and they would all be here today.",sad
Mmhmm.,neutral
"To bring that on to the earth again, you know, is like some kind of monument and I thought I would just make a difference to them.",sad
"But then I came home and it was incredible, you know? The whole thing was just kind of this random bus accident. You know, I went back to the rat race again, I went to work.",sad
And I didn't want any of it. I guess that included you.,sad
I just want you to know Annie.,neutral
What would I do with a fortune?,happy
Fine.,neutral
What flashlight?,surprise
"The flashlight, the silver one. There's only one, isn't there?",neutral
That's not your flashlight.,neutral
Whose is it?,neutral
"Oh...well. Yeah, of course.",neutral
You keep saying my flashlight like it's just yours.,angry
No.,neutral
How's that supposed to make me feel?,angry
"Of course, our flashlight. What's yours is mine. Me flashlight es su flashlight.",neutral
Do they always run during a full moon? I don't remember. Was it full last year?,neutral
Yeah.,neutral
"Huh. Are you cold? Do you want my jacket? No? you know, we should have brought the blanket? Our blanket.",neutral
"Aw. Do you know, I should have brought a six pack, too. A six pack, that would be just the ticket right about now. Huh?",neutral
[LAUGHTER],happy
I'm cold.,sad
Right.,neutral
"Wait, that's my point, too.",neutral
Not particularly.,neutral
Why not?,neutral
"Honey, this is like a natural phenomenon. I mean... People in Kansas would have to get plane reservations and get hotel rooms to see this. It's just forty minutes away for us; it's too good to pass up.",neutral
Yeah. But this..this moment on the beach is like the highlight of their little lives. All that flopping around is laying eggs or what to do - spawning or mating or whatever.,neutral
This is a big night for these little guys. It's like life's last orgy.,neutral
"There's like mystery here, there's magic. It's like a little bit of the unexplainable. I just can't see how you're not interested.",neutral
For real?,surprise
"God, I don't get it. you know the first time we came here, you said it was the best night of your life?",neutral
"And last year, I remember distinctly you said, you were so excited to get here that you don't remember you stubbed your toe until we were in the car.",neutral
Ahh...we weren't in a good spot.,neutral
"We just weren't in a good spot. I'm telling you, this is a much better spot. I have instincts for these things.",neutral
"God, this is great. Think about this. I know you are not interested, but just think about this.",happy
That's the wind.,neutral
So what do you think?,happy
About what?,neutral
"About all of that, about all I was talking about.",happy
That's the wind.,neutral
About what?,neutral
About what I was saying.,neutral
"Carla, can I ask you something? Now, don't take this the wrong way, but are you on your period?",neutral
"Don't ask me that. I hate it when you ask me that, you always ask me that. It's insulting.",angry
"For God- Grow up, Augie. The fish are not going to arrive.",angry
Because they never do. Have they...Have they ever?,angry
Twice is every time we have tried; that's ever.,angry
"I feel like I'm always just standing here waiting. I feel like this night is going to be the night, but it never is.",sad
"For God's sake, this is not about fish.",angry
"Okay. So you were fine during that phone call from Marge and then dinner was okay. And doing the dishes was fine and then I was going to take a shower and you're watching the news and you said the grunions are running tonight, do you want to go? And I said, sure great, let's go.",neutral
"Okay. So I am putting out the pets, getting the car out of the garage.",neutral
Do you remember the first year we came here? It was like four years after we got married.,neutral
"You whispered the sweetest, most intimate things to me right into my ear so I could feel them as much as hear them. And I remember thinking, this is it. You know, finally, I am as happy as I'm supposed to be.",happy
"It's when we were driving past that Knickerbocker Liquor Locker, you said, let's get some champagne. I said no, time's a wasting or something like that.",neutral
I'd rather not remember some things. I'd rather not hope for some things.,sad
Sure. All right. Okay.,neutral
"Listen, do you want to dance?",neutral
No.,neutral
Do you want me to go get some champagne?,neutral
Do you want to take off your shoes?,happy
Do you want to get married again?,happy
No.,neutral
Yes it is.,neutral
"I know you are Augie, I know.",sad
"I know you meant this to be special, I know that you wanted it to be right, but I just can't help thinking that, I can't help wishing that I was somewhere else.",sad
"Maybe if you were with someone else, too.",sad
I didn't say that.,sad
I just- I know I don't make you happy.,sad
"Don't be ridiculous. Anything that- anything I am doing, I'd rather be doing it with you.",surprise
Yeah?,surprise
Yeah. Don't you know that?,surprise
"You're the one who probably wishes he was with somebody else. Somebody who doesn't take things so seriously, who could enjoy herself.",sad
"You know, actually now that you mention it, no I don't.",neutral
"So maybe we are in the wrong spot, but we are with the right person.",neutral
"We have a great view of the moon from here, though, huh?",neutral
"Hmm. I noticed that, it's pretty. Big old white moon.",happy
[BREATHING],neutral
And look what I got here.,happy
"Augie, you bought refreshments.",happy
I guess we don't need glasses.,happy
[BREATHING],happy
Do you want to go home? Are you cold?,neutral
I'm beginning to think this might be the right spot after all.,happy
"Augie, I'm sorry.",sad
"Shh. If we're very quiet, the fish might come.",neutral
Or not.,neutral
Or not.,happy
Good God.,fear
Is it them?,fear
I wonder.,fear
Freda is the only one who knows we are here. She wouldn't ring up.,fear
It must be them then.,fear
It had to happen sooner or later. What are we going to do?,fear
[BREATHING],fear
No. Wrong number. [LAUGHTER],happy
[LAUGHTER] That sent shivers up my spine.,happy
What shall we do if they suddenly walk in on us.[LAUGHTER],happy
With perfect poise.,happy
"It's strange; things that ought to matter dreadfully, they just don't matter at all when one's happy. Do they?",happy
Yes. Meaning just that.,happy
"Well what does it all mean? That's what I ask myself in my quest for ultimate truth. Dear God, what does it all mean?",happy
Don't laugh at me. I'm being serious.,happy
Who knows?,happy
[LAUGHTER],happy
Oh Come and kiss me darling before your body rots and worms pop out of your eye sockets.,happy
"Oh Elliott, worms don't pop.",happy
"Oh See, I don't care what you do, see. You can paint yourself green and run naked through the Place Vendome and run off with all of the men of the world. I shan't say a word, just as long as you love me best.",happy
"Aw. Thank you, darling. The same applies to you too, except that if you so much as look at another woman I'll kill you.",happy
It was a terrible thing. I hated it.,disgust
"That was a rouser, wasn't it?",happy
